{
  "id": "formula/and-or-precedence",
  "kind": "formula",
  "description": "and binds tighter than or.",
  "valid": true,
  "input": "flag or flag and not flag",
  "env": {
    "aliases": {},
    "functions": {},
    "name": "calc.example.net/f",
    "signature": {
      "args": {
        "a": {
          "type": "number",
          "valid": false,
          "unit": "EUR"
        },
        "b": {
          "type": "number",
          "valid": false,
          "unit": "EUR"
        },
        "c": {
          "type": "number",
          "valid": false,
          "unit": "USD"
        },
        "n": {
          "type": "number",
          "valid": false,
          "unit": "1"
        },
        "k": {
          "type": "number",
          "valid": false,
          "unit": "1"
        },
        "x": {
          "type": "number",
          "valid": false,
          "unit": "1"
        },
        "r": {
          "type": "number",
          "valid": false,
          "unit": "percent"
        },
        "t1": {
          "type": "number",
          "valid": false,
          "unit": "degC"
        },
        "t2": {
          "type": "number",
          "valid": false,
          "unit": "degC"
        },
        "amount": {
          "type": "number",
          "valid": false,
          "unit": {
            "arg": "base"
          }
        },
        "count": {
          "type": "number",
          "valid": false,
          "unit": "count"
        },
        "plat": {
          "type": "number",
          "valid": false,
          "unit": "deg"
        },
        "plon": {
          "type": "number",
          "valid": false,
          "unit": "deg"
        },
        "dist": {
          "type": "number",
          "valid": false,
          "unit": "m"
        },
        "secs": {
          "type": "number",
          "valid": false,
          "unit": "s"
        },
        "s": {
          "type": "string",
          "valid": false
        },
        "name": {
          "type": "string",
          "valid": false
        },
        "base": {
          "type": "string",
          "valid": false
        },
        "quote": {
          "type": "string",
          "valid": false
        },
        "station": {
          "type": "string",
          "valid": false
        },
        "tenor": {
          "type": "string",
          "valid": false
        },
        "item": {
          "type": "string",
          "valid": false
        },
        "stations": {
          "type": "string",
          "valid": false
        },
        "p": {
          "type": "string",
          "valid": false
        },
        "d": {
          "type": "date",
          "valid": true
        },
        "d2": {
          "type": "date",
          "valid": true
        },
        "t": {
          "type": "instant",
          "valid": true
        },
        "flag": {
          "type": "boolean",
          "valid": false
        }
      },
      "order": [
        "a",
        "amount",
        "b",
        "base",
        "c",
        "count",
        "d",
        "d2",
        "dist",
        "flag",
        "item",
        "k",
        "n",
        "name",
        "p",
        "plat",
        "plon",
        "quote",
        "r",
        "s",
        "secs",
        "station",
        "stations",
        "t",
        "t1",
        "t2",
        "tenor",
        "x"
      ],
      "returns": "boolean"
    }
  },
  "ast": "{\"args\":[{\"name\":\"flag\",\"node\":\"var\"},{\"args\":[{\"name\":\"flag\",\"node\":\"var\"},{\"args\":[{\"name\":\"flag\",\"node\":\"var\"}],\"node\":\"op\",\"op\":\"not\"}],\"node\":\"op\",\"op\":\"and\"}],\"node\":\"op\",\"op\":\"or\"}",
  "ast_sha256": "5383480caca33570519b7a8a10f8356816c8745ed7177c0caa8767ce647e527f",
  "body": "flag or flag and not flag\n",
  "inputs": [],
  "returns": {
    "type": "boolean"
  },
  "asof_dependent": false
}
