{
  "id": "excel/workday",
  "kind": "excel",
  "description": "=WORKDAY(DATE(2026,4,1),3,H1:H2) is supported as add_days(2026-04-01, 3, calendar: sheet.example.org/holiday(*)). Holidays in H1:H2 = 2026-04-03, 2026-04-06.",
  "valid": true,
  "excel": "=WORKDAY(DATE(2026,4,1),3,H1:H2)",
  "doc": "https://support.microsoft.com/en-us/excel/functions/workday-function",
  "documentation_derived": true,
  "status": "supported",
  "sample": "Holidays in H1:H2 = 2026-04-03, 2026-04-06.",
  "excel_result": {
    "type": "date",
    "value": "2026-04-08"
  },
  "formula": "add_days(2026-04-01, 3, calendar: sheet.example.org/holiday(*))",
  "signature": {
    "args": {},
    "order": [],
    "returns": "date"
  },
  "world": {
    "functions": {
      "sheet.example.org/holiday": {
        "bound": "2026-01-01T00:00:00.000000Z",
        "descriptor": {
          "code": {
            "body": "",
            "lang": "stored"
          },
          "inputs": [],
          "signature": {
            "args": {
              "date": {
                "type": "date",
                "valid": true
              }
            },
            "returns": "string",
            "order": [
              "date"
            ]
          }
        }
      }
    },
    "receipts": [
      {
        "asof": "2026-02-01T00:00:00.000000Z",
        "cell": {
          "args": {
            "date": {
              "type": "date",
              "value": "2026-04-03"
            }
          },
          "fn": "holiday",
          "fn_hash": "905f911d548b638072a1e73654a0e18a4c5b3f98643f6c1c0c2b950cecde6d2c",
          "ns": "sheet.example.org"
        },
        "computed_by": "sheet.example.org#206a7d600aae48b2",
        "inputs": [],
        "issued": "2026-02-01T00:00:00.000000Z",
        "licence": "CC-BY-4.0",
        "proto": "datumesh/1",
        "publisher": "sheet.example.org",
        "summary": "A recorded value of holiday.",
        "tx": "2026-02-01T00:00:00.000000Z",
        "type": "string",
        "valid": {
          "date": {
            "type": "date",
            "value": "2026-04-03"
          }
        },
        "value": "Good Friday",
        "sig": "c47e793de929e7c97a8e59041ea45062b340e8972ac4c8350c2fe9bc52881339437284b1af3cfd6be860b49b018ed7a1cadf0895235011a6e168d51a04891806"
      },
      {
        "asof": "2026-02-01T00:00:00.000000Z",
        "cell": {
          "args": {
            "date": {
              "type": "date",
              "value": "2026-04-06"
            }
          },
          "fn": "holiday",
          "fn_hash": "905f911d548b638072a1e73654a0e18a4c5b3f98643f6c1c0c2b950cecde6d2c",
          "ns": "sheet.example.org"
        },
        "computed_by": "sheet.example.org#206a7d600aae48b2",
        "inputs": [],
        "issued": "2026-02-01T00:00:00.000000Z",
        "licence": "CC-BY-4.0",
        "proto": "datumesh/1",
        "publisher": "sheet.example.org",
        "summary": "A recorded value of holiday.",
        "tx": "2026-02-01T00:00:00.000000Z",
        "type": "string",
        "valid": {
          "date": {
            "type": "date",
            "value": "2026-04-06"
          }
        },
        "value": "Easter Monday",
        "sig": "485eb1e39bd88e3500b2d22c7fb632fa3ead191023964558152930f207e5d348bd70b6ba02c3977163955a2c174540f1f54456600c964d1a058422a59551810b"
      }
    ]
  },
  "cell": {
    "args": {},
    "fn": "sheet.example.net/case"
  },
  "asof": "2026-06-01T00:00:00.000000Z",
  "receipt_hash": "931dda21ab805b53242f8a0000aeef2ea1f3a16418695df3f082caeb8e847e7f",
  "body": "add_days(2026-04-01, 3, calendar: sheet.example.org/holiday(date: *))\n",
  "value": {
    "type": "date",
    "value": "2026-04-08"
  },
  "lineage": [
    "slice:2a632a0287ef3d86ff6627052678582f6a31ba49f3797c0d88c77faa569d1478:9f1af593cbf8288982cb696a0c22cc3eec9ff2b82994c007eff37e9d76fa78ce"
  ],
  "tx": "2026-02-01T00:00:00.000000Z",
  "receipt_asof": "2026-02-01T00:00:00.000000Z",
  "fuel_used": 14
}
