{
  "id": "formula/alias-path",
  "kind": "formula",
  "description": "An alias with a path.",
  "valid": true,
  "input": "@ecb/fx_rate(base: base, date: d, quote: quote)",
  "env": {
    "aliases": {
      "ecb/fx_rate": "rates.example.org/fx_rate"
    },
    "functions": {
      "rates.example.org/fx_rate": {
        "code": {
          "body": "",
          "lang": "stored"
        },
        "inputs": [],
        "signature": {
          "args": {
            "base": {
              "type": "string",
              "valid": false
            },
            "date": {
              "type": "date",
              "valid": true
            },
            "quote": {
              "type": "string",
              "valid": false
            }
          },
          "returns": {
            "type": "number",
            "unit": {
              "of": {
                "arg": "quote"
              },
              "per": {
                "arg": "base"
              }
            }
          },
          "order": [
            "base",
            "quote",
            "date"
          ]
        }
      }
    },
    "name": "calc.example.net/f",
    "signature": {
      "args": {
        "a": {
          "type": "number",
          "valid": false,
          "unit": "EUR"
        },
        "b": {
          "type": "number",
          "valid": false,
          "unit": "EUR"
        },
        "c": {
          "type": "number",
          "valid": false,
          "unit": "USD"
        },
        "n": {
          "type": "number",
          "valid": false,
          "unit": "1"
        },
        "k": {
          "type": "number",
          "valid": false,
          "unit": "1"
        },
        "x": {
          "type": "number",
          "valid": false,
          "unit": "1"
        },
        "r": {
          "type": "number",
          "valid": false,
          "unit": "percent"
        },
        "t1": {
          "type": "number",
          "valid": false,
          "unit": "degC"
        },
        "t2": {
          "type": "number",
          "valid": false,
          "unit": "degC"
        },
        "amount": {
          "type": "number",
          "valid": false,
          "unit": {
            "arg": "base"
          }
        },
        "count": {
          "type": "number",
          "valid": false,
          "unit": "count"
        },
        "plat": {
          "type": "number",
          "valid": false,
          "unit": "deg"
        },
        "plon": {
          "type": "number",
          "valid": false,
          "unit": "deg"
        },
        "dist": {
          "type": "number",
          "valid": false,
          "unit": "m"
        },
        "secs": {
          "type": "number",
          "valid": false,
          "unit": "s"
        },
        "s": {
          "type": "string",
          "valid": false
        },
        "name": {
          "type": "string",
          "valid": false
        },
        "base": {
          "type": "string",
          "valid": false
        },
        "quote": {
          "type": "string",
          "valid": false
        },
        "station": {
          "type": "string",
          "valid": false
        },
        "tenor": {
          "type": "string",
          "valid": false
        },
        "item": {
          "type": "string",
          "valid": false
        },
        "stations": {
          "type": "string",
          "valid": false
        },
        "p": {
          "type": "string",
          "valid": false
        },
        "d": {
          "type": "date",
          "valid": true
        },
        "d2": {
          "type": "date",
          "valid": true
        },
        "t": {
          "type": "instant",
          "valid": true
        },
        "flag": {
          "type": "boolean",
          "valid": false
        }
      },
      "order": [
        "a",
        "amount",
        "b",
        "base",
        "c",
        "count",
        "d",
        "d2",
        "dist",
        "flag",
        "item",
        "k",
        "n",
        "name",
        "p",
        "plat",
        "plon",
        "quote",
        "r",
        "s",
        "secs",
        "station",
        "stations",
        "t",
        "t1",
        "t2",
        "tenor",
        "x"
      ],
      "returns": {
        "type": "number",
        "unit": {
          "of": {
            "arg": "quote"
          },
          "per": {
            "arg": "base"
          }
        }
      }
    }
  },
  "ast": "{\"args\":{\"base\":{\"name\":\"base\",\"node\":\"var\"},\"date\":{\"name\":\"d\",\"node\":\"var\"},\"quote\":{\"name\":\"quote\",\"node\":\"var\"}},\"fn\":\"rates.example.org/fx_rate\",\"node\":\"read\"}",
  "ast_sha256": "241fea80f0b47866a3c94c98e4776eb73c21d7868af7c30daf518f86f45da538",
  "body": "rates.example.org/fx_rate(base: base, date: d, quote: quote)\n",
  "inputs": [
    "rates.example.org/fx_rate"
  ],
  "returns": {
    "type": "number",
    "unit": "arg:base^-1 arg:quote"
  },
  "asof_dependent": false
}
