{
  "id": "cell/slice",
  "kind": "cell",
  "description": "A slice: an argument bound to \"*\". Canonicalisable, never a receipt. Changed in spec-0.2.0: fn_hash is the hash of a descriptor that now declares units.",
  "valid": true,
  "input": "{\n  \"ns\": \"rates.example.org\",\n  \"fn_hash\": \"7b58ecb8fd23b644c87951d0bd609790ff547cbb23fed27186c669ce2ce0aa80\",\n  \"fn\": \"fx_rate\",\n  \"args\": {\n    \"quote\": {\n      \"value\": \"USD\",\n      \"type\": \"string\"\n    },\n    \"date\": \"*\",\n    \"base\": {\n      \"value\": \"EUR\",\n      \"type\": \"string\"\n    }\n  }\n}",
  "canonical": "{\"args\":{\"base\":{\"type\":\"string\",\"value\":\"EUR\"},\"date\":\"*\",\"quote\":{\"type\":\"string\",\"value\":\"USD\"}},\"fn\":\"fx_rate\",\"fn_hash\":\"7b58ecb8fd23b644c87951d0bd609790ff547cbb23fed27186c669ce2ce0aa80\",\"ns\":\"rates.example.org\"}",
  "sha256": "6046e961e3573d42422565754037c2b4d1c4bfe744f3a3a323d69b62c71c10f8"
}
