{
  "id": "formula/lookup-along",
  "kind": "formula",
  "description": "along names the dimension.",
  "valid": true,
  "input": "latest(at(weather.example.org/temp(*, *), station, along: station))",
  "env": {
    "aliases": {},
    "functions": {
      "weather.example.org/temp": {
        "code": {
          "body": "",
          "lang": "stored"
        },
        "inputs": [],
        "signature": {
          "args": {
            "station": {
              "type": "string",
              "valid": false
            },
            "t": {
              "type": "instant",
              "valid": true
            }
          },
          "returns": {
            "type": "number",
            "unit": "degC"
          },
          "order": [
            "station",
            "t"
          ]
        }
      }
    },
    "name": "calc.example.net/f",
    "signature": {
      "args": {
        "a": {
          "type": "number",
          "valid": false,
          "unit": "EUR"
        },
        "b": {
          "type": "number",
          "valid": false,
          "unit": "EUR"
        },
        "c": {
          "type": "number",
          "valid": false,
          "unit": "USD"
        },
        "n": {
          "type": "number",
          "valid": false,
          "unit": "1"
        },
        "k": {
          "type": "number",
          "valid": false,
          "unit": "1"
        },
        "x": {
          "type": "number",
          "valid": false,
          "unit": "1"
        },
        "r": {
          "type": "number",
          "valid": false,
          "unit": "percent"
        },
        "t1": {
          "type": "number",
          "valid": false,
          "unit": "degC"
        },
        "t2": {
          "type": "number",
          "valid": false,
          "unit": "degC"
        },
        "amount": {
          "type": "number",
          "valid": false,
          "unit": {
            "arg": "base"
          }
        },
        "count": {
          "type": "number",
          "valid": false,
          "unit": "count"
        },
        "plat": {
          "type": "number",
          "valid": false,
          "unit": "deg"
        },
        "plon": {
          "type": "number",
          "valid": false,
          "unit": "deg"
        },
        "dist": {
          "type": "number",
          "valid": false,
          "unit": "m"
        },
        "secs": {
          "type": "number",
          "valid": false,
          "unit": "s"
        },
        "s": {
          "type": "string",
          "valid": false
        },
        "name": {
          "type": "string",
          "valid": false
        },
        "base": {
          "type": "string",
          "valid": false
        },
        "quote": {
          "type": "string",
          "valid": false
        },
        "station": {
          "type": "string",
          "valid": false
        },
        "tenor": {
          "type": "string",
          "valid": false
        },
        "item": {
          "type": "string",
          "valid": false
        },
        "stations": {
          "type": "string",
          "valid": false
        },
        "p": {
          "type": "string",
          "valid": false
        },
        "d": {
          "type": "date",
          "valid": true
        },
        "d2": {
          "type": "date",
          "valid": true
        },
        "t": {
          "type": "instant",
          "valid": true
        },
        "flag": {
          "type": "boolean",
          "valid": false
        }
      },
      "order": [
        "a",
        "amount",
        "b",
        "base",
        "c",
        "count",
        "d",
        "d2",
        "dist",
        "flag",
        "item",
        "k",
        "n",
        "name",
        "p",
        "plat",
        "plon",
        "quote",
        "r",
        "s",
        "secs",
        "station",
        "stations",
        "t",
        "t1",
        "t2",
        "tenor",
        "x"
      ],
      "returns": {
        "type": "number",
        "unit": "degC"
      }
    }
  },
  "ast": "{\"args\":[{\"args\":[{\"args\":{\"station\":{\"node\":\"open\"},\"t\":{\"node\":\"open\"}},\"fn\":\"weather.example.org/temp\",\"node\":\"read\"},{\"name\":\"station\",\"node\":\"var\"}],\"fn\":\"at\",\"named\":{\"along\":{\"name\":\"station\",\"node\":\"key\"}},\"node\":\"call\"}],\"fn\":\"latest\",\"named\":{},\"node\":\"call\"}",
  "ast_sha256": "038275fc207ba9ae8924b055f7de1ed0f79fcef1d6d88049a8ab094a9394ecc2",
  "body": "latest(at(weather.example.org/temp(station: *, t: *), station, along: station))\n",
  "inputs": [
    "weather.example.org/temp"
  ],
  "returns": {
    "type": "number",
    "unit": "degC"
  },
  "asof_dependent": false
}
