{
  "id": "formula/versions-count",
  "kind": "formula",
  "description": "A version slice.",
  "valid": true,
  "input": "count(versions(data.example.org/price(item: s), 2024-01-01T00:00:00.000000Z, asof()))",
  "env": {
    "aliases": {},
    "functions": {
      "data.example.org/price": {
        "code": {
          "body": "",
          "lang": "stored"
        },
        "inputs": [],
        "signature": {
          "args": {
            "item": {
              "type": "string",
              "valid": false
            }
          },
          "returns": {
            "type": "number",
            "unit": "EUR"
          },
          "order": [
            "item"
          ]
        }
      }
    },
    "name": "calc.example.net/f",
    "signature": {
      "args": {
        "a": {
          "type": "number",
          "valid": false,
          "unit": "EUR"
        },
        "b": {
          "type": "number",
          "valid": false,
          "unit": "EUR"
        },
        "c": {
          "type": "number",
          "valid": false,
          "unit": "USD"
        },
        "n": {
          "type": "number",
          "valid": false,
          "unit": "1"
        },
        "k": {
          "type": "number",
          "valid": false,
          "unit": "1"
        },
        "x": {
          "type": "number",
          "valid": false,
          "unit": "1"
        },
        "r": {
          "type": "number",
          "valid": false,
          "unit": "percent"
        },
        "t1": {
          "type": "number",
          "valid": false,
          "unit": "degC"
        },
        "t2": {
          "type": "number",
          "valid": false,
          "unit": "degC"
        },
        "amount": {
          "type": "number",
          "valid": false,
          "unit": {
            "arg": "base"
          }
        },
        "count": {
          "type": "number",
          "valid": false,
          "unit": "count"
        },
        "plat": {
          "type": "number",
          "valid": false,
          "unit": "deg"
        },
        "plon": {
          "type": "number",
          "valid": false,
          "unit": "deg"
        },
        "dist": {
          "type": "number",
          "valid": false,
          "unit": "m"
        },
        "secs": {
          "type": "number",
          "valid": false,
          "unit": "s"
        },
        "s": {
          "type": "string",
          "valid": false
        },
        "name": {
          "type": "string",
          "valid": false
        },
        "base": {
          "type": "string",
          "valid": false
        },
        "quote": {
          "type": "string",
          "valid": false
        },
        "station": {
          "type": "string",
          "valid": false
        },
        "tenor": {
          "type": "string",
          "valid": false
        },
        "item": {
          "type": "string",
          "valid": false
        },
        "stations": {
          "type": "string",
          "valid": false
        },
        "p": {
          "type": "string",
          "valid": false
        },
        "d": {
          "type": "date",
          "valid": true
        },
        "d2": {
          "type": "date",
          "valid": true
        },
        "t": {
          "type": "instant",
          "valid": true
        },
        "flag": {
          "type": "boolean",
          "valid": false
        }
      },
      "order": [
        "a",
        "amount",
        "b",
        "base",
        "c",
        "count",
        "d",
        "d2",
        "dist",
        "flag",
        "item",
        "k",
        "n",
        "name",
        "p",
        "plat",
        "plon",
        "quote",
        "r",
        "s",
        "secs",
        "station",
        "stations",
        "t",
        "t1",
        "t2",
        "tenor",
        "x"
      ],
      "returns": {
        "type": "number",
        "unit": "count"
      }
    }
  },
  "ast": "{\"args\":[{\"args\":[{\"args\":{\"item\":{\"name\":\"s\",\"node\":\"var\"}},\"fn\":\"data.example.org/price\",\"node\":\"read\"},{\"node\":\"instant\",\"value\":\"2024-01-01T00:00:00.000000Z\"},{\"args\":[],\"fn\":\"asof\",\"named\":{},\"node\":\"call\"}],\"fn\":\"versions\",\"named\":{},\"node\":\"call\"}],\"fn\":\"count\",\"named\":{},\"node\":\"call\"}",
  "ast_sha256": "8722a49dd247a8e2e3613f9ac0724f2de6baff882867326c536cdc6838f5cc2d",
  "body": "count(versions(data.example.org/price(item: s), 2024-01-01T00:00:00.000000Z, asof()))\n",
  "inputs": [
    "data.example.org/price"
  ],
  "returns": {
    "type": "number",
    "unit": "count"
  },
  "asof_dependent": true
}
