{
  "id": "receipt/computed-with-lineage",
  "kind": "receipt",
  "description": "A computed cell signed by another party, with its input receipt hash; full verification checks the input, its declared function, asof and tx.",
  "valid": true,
  "input": "{\n  \"sig\": \"6739534c70657d37c896c1c60bc017ac3a8867a6bbdf7aa561fd806b24eb829a464ea90c00ffcaa795bb34eb195c1c2174ff4f895d3b9c2d6e429409279b3806\",\n  \"value\": \"108.92\",\n  \"valid\": {\n    \"date\": {\n      \"value\": \"2024-03-15\",\n      \"type\": \"date\"\n    }\n  },\n  \"type\": \"number\",\n  \"tx\": \"2024-03-15T16:00:00.000000Z\",\n  \"summary\": \"100 EUR converted to USD at the 15 March 2024 rate is 108.92.\",\n  \"publisher\": \"calc.example.net\",\n  \"proto\": \"datumesh/1\",\n  \"licence\": \"CC-BY-4.0\",\n  \"issued\": \"2024-03-16T09:00:01.250000Z\",\n  \"inputs\": [\n    \"501f744d910c585859a5be4f3b62385ed0d6803db53dbbf95dff5097a68bee0d\"\n  ],\n  \"computed_by\": \"calc.example.net#f7ec60a92abf4774\",\n  \"cell\": {\n    \"ns\": \"calc.example.net\",\n    \"fn_hash\": \"794a960b7fa32ae7763a2308766864b52fa27920f48fb328b5c3413300eaf876\",\n    \"fn\": \"convert\",\n    \"args\": {\n      \"quote\": {\n        \"value\": \"USD\",\n        \"type\": \"string\"\n      },\n      \"date\": {\n        \"value\": \"2024-03-15\",\n        \"type\": \"date\"\n      },\n      \"base\": {\n        \"value\": \"EUR\",\n        \"type\": \"string\"\n      },\n      \"amount\": {\n        \"value\": \"100\",\n        \"type\": \"number\"\n      }\n    }\n  },\n  \"asof\": \"2024-03-16T09:00:00.000000Z\"\n}",
  "keypair": {
    "seed": "81589e69e00a82e983f0274d169ffa6c2ea7bc26833833826e57ce690125d5b5",
    "public": "ccd4faa3a0b8338bc796d3bfc30bda2f6e87d336a576b70dc9d47cbfe0e8830f",
    "key_id": "f7ec60a92abf4774"
  },
  "keys": {
    "rates.example.org": {
      "https": {
        "status": 200,
        "body": "{\n  \"host\": \"rates.example.org\",\n  \"keys\": [\n    {\n      \"alg\": \"ed25519\",\n      \"id\": \"d712b32a2cc5cb7c\",\n      \"public\": \"843baeb22bfd0364fb1b7262b367fb3202e7886c69a070fecf8e343fedb1eabf\",\n      \"valid_from\": \"2020-01-01T00:00:00.000000Z\",\n      \"valid_to\": \"2024-06-01T00:00:00.000000Z\"\n    },\n    {\n      \"alg\": \"ed25519\",\n      \"id\": \"d9a2df65559c4444\",\n      \"public\": \"3ecf7b3ff834cb6782f5405dfcb213b5e78c0f30188068c25568adc25a739b52\",\n      \"valid_from\": \"2024-06-01T00:00:00.000000Z\"\n    }\n  ],\n  \"proto\": \"datumesh/1\"\n}"
      },
      "dns": {
        "status": "nxdomain"
      }
    },
    "calc.example.net": {
      "https": {
        "status": 200,
        "body": "{\n  \"host\": \"calc.example.net\",\n  \"keys\": [\n    {\n      \"alg\": \"ed25519\",\n      \"id\": \"f7ec60a92abf4774\",\n      \"public\": \"ccd4faa3a0b8338bc796d3bfc30bda2f6e87d336a576b70dc9d47cbfe0e8830f\",\n      \"valid_from\": \"2020-01-01T00:00:00.000000Z\"\n    }\n  ],\n  \"proto\": \"datumesh/1\"\n}"
      },
      "dns": {
        "status": "nxdomain"
      }
    }
  },
  "recompute": {
    "descriptor": {
      "code": {
        "body": "amount * rates.example.org/fx_rate(base: base, date: date, quote: quote)\n",
        "lang": "expr"
      },
      "inputs": [
        "rates.example.org/fx_rate"
      ],
      "signature": {
        "args": {
          "amount": {
            "type": "number",
            "valid": false
          },
          "base": {
            "type": "string",
            "valid": false
          },
          "date": {
            "type": "date",
            "valid": true
          },
          "quote": {
            "type": "string",
            "valid": false
          }
        },
        "returns": "number"
      }
    },
    "inputs": {
      "501f744d910c585859a5be4f3b62385ed0d6803db53dbbf95dff5097a68bee0d": "{\n  \"sig\": \"e2d778dfb2ff9650521da446b4626f4fa76f547bf27ab2cca8bd56e9270f9a9e3dc24970d98705f3c371502cf4dbcaec99f9361851a436854c984c03a10e5603\",\n  \"value\": \"1.0892\",\n  \"valid\": {\n    \"date\": {\n      \"value\": \"2024-03-15\",\n      \"type\": \"date\"\n    }\n  },\n  \"type\": \"number\",\n  \"tx\": \"2024-03-15T16:00:00.000000Z\",\n  \"summary\": \"1 EUR was worth 1.0892 USD at the 15 March 2024 reference rate.\",\n  \"publisher\": \"rates.example.org\",\n  \"proto\": \"datumesh/1\",\n  \"licence\": \"CC-BY-4.0\",\n  \"issued\": \"2024-03-16T09:00:00.000000Z\",\n  \"inputs\": [],\n  \"computed_by\": \"rates.example.org#d712b32a2cc5cb7c\",\n  \"cell\": {\n    \"ns\": \"rates.example.org\",\n    \"fn_hash\": \"88445cddbf86a358e1318934bfc8160728a9a0ff2b05b50be6c0fee2eb3e5af4\",\n    \"fn\": \"fx_rate\",\n    \"args\": {\n      \"quote\": {\n        \"value\": \"USD\",\n        \"type\": \"string\"\n      },\n      \"date\": {\n        \"value\": \"2024-03-15\",\n        \"type\": \"date\"\n      },\n      \"base\": {\n        \"value\": \"EUR\",\n        \"type\": \"string\"\n      }\n    }\n  },\n  \"asof\": \"2024-03-16T09:00:00.000000Z\"\n}"
    },
    "value": {
      "type": "number",
      "value": "108.92"
    }
  },
  "canonical": "{\"asof\":\"2024-03-16T09:00:00.000000Z\",\"cell\":{\"args\":{\"amount\":{\"type\":\"number\",\"value\":\"100\"},\"base\":{\"type\":\"string\",\"value\":\"EUR\"},\"date\":{\"type\":\"date\",\"value\":\"2024-03-15\"},\"quote\":{\"type\":\"string\",\"value\":\"USD\"}},\"fn\":\"convert\",\"fn_hash\":\"794a960b7fa32ae7763a2308766864b52fa27920f48fb328b5c3413300eaf876\",\"ns\":\"calc.example.net\"},\"computed_by\":\"calc.example.net#f7ec60a92abf4774\",\"inputs\":[\"501f744d910c585859a5be4f3b62385ed0d6803db53dbbf95dff5097a68bee0d\"],\"issued\":\"2024-03-16T09:00:01.250000Z\",\"licence\":\"CC-BY-4.0\",\"proto\":\"datumesh/1\",\"publisher\":\"calc.example.net\",\"summary\":\"100 EUR converted to USD at the 15 March 2024 rate is 108.92.\",\"tx\":\"2024-03-15T16:00:00.000000Z\",\"type\":\"number\",\"valid\":{\"date\":{\"type\":\"date\",\"value\":\"2024-03-15\"}},\"value\":\"108.92\"}",
  "sha256": "46cce62c62419ba5486cc592d47affa453901e003e61327bedeec8dfd69bc859",
  "sig": "6739534c70657d37c896c1c60bc017ac3a8867a6bbdf7aa561fd806b24eb829a464ea90c00ffcaa795bb34eb195c1c2174ff4f895d3b9c2d6e429409279b3806",
  "level": "recomputed"
}
