{
  "id": "formula/aggregate-max",
  "kind": "formula",
  "description": "max over a slice.",
  "valid": true,
  "input": "max(data.example.org/daily(*))",
  "env": {
    "aliases": {},
    "functions": {
      "data.example.org/daily": {
        "code": {
          "body": "",
          "lang": "stored"
        },
        "inputs": [],
        "signature": {
          "args": {
            "date": {
              "type": "date",
              "valid": true
            }
          },
          "returns": {
            "type": "number",
            "unit": "EUR"
          },
          "order": [
            "date"
          ]
        }
      }
    },
    "name": "calc.example.net/f",
    "signature": {
      "args": {
        "a": {
          "type": "number",
          "valid": false,
          "unit": "EUR"
        },
        "b": {
          "type": "number",
          "valid": false,
          "unit": "EUR"
        },
        "c": {
          "type": "number",
          "valid": false,
          "unit": "USD"
        },
        "n": {
          "type": "number",
          "valid": false,
          "unit": "1"
        },
        "k": {
          "type": "number",
          "valid": false,
          "unit": "1"
        },
        "x": {
          "type": "number",
          "valid": false,
          "unit": "1"
        },
        "r": {
          "type": "number",
          "valid": false,
          "unit": "percent"
        },
        "t1": {
          "type": "number",
          "valid": false,
          "unit": "degC"
        },
        "t2": {
          "type": "number",
          "valid": false,
          "unit": "degC"
        },
        "amount": {
          "type": "number",
          "valid": false,
          "unit": {
            "arg": "base"
          }
        },
        "count": {
          "type": "number",
          "valid": false,
          "unit": "count"
        },
        "plat": {
          "type": "number",
          "valid": false,
          "unit": "deg"
        },
        "plon": {
          "type": "number",
          "valid": false,
          "unit": "deg"
        },
        "dist": {
          "type": "number",
          "valid": false,
          "unit": "m"
        },
        "secs": {
          "type": "number",
          "valid": false,
          "unit": "s"
        },
        "s": {
          "type": "string",
          "valid": false
        },
        "name": {
          "type": "string",
          "valid": false
        },
        "base": {
          "type": "string",
          "valid": false
        },
        "quote": {
          "type": "string",
          "valid": false
        },
        "station": {
          "type": "string",
          "valid": false
        },
        "tenor": {
          "type": "string",
          "valid": false
        },
        "item": {
          "type": "string",
          "valid": false
        },
        "stations": {
          "type": "string",
          "valid": false
        },
        "p": {
          "type": "string",
          "valid": false
        },
        "d": {
          "type": "date",
          "valid": true
        },
        "d2": {
          "type": "date",
          "valid": true
        },
        "t": {
          "type": "instant",
          "valid": true
        },
        "flag": {
          "type": "boolean",
          "valid": false
        }
      },
      "order": [
        "a",
        "amount",
        "b",
        "base",
        "c",
        "count",
        "d",
        "d2",
        "dist",
        "flag",
        "item",
        "k",
        "n",
        "name",
        "p",
        "plat",
        "plon",
        "quote",
        "r",
        "s",
        "secs",
        "station",
        "stations",
        "t",
        "t1",
        "t2",
        "tenor",
        "x"
      ],
      "returns": {
        "type": "number",
        "unit": "EUR"
      }
    }
  },
  "ast": "{\"args\":[{\"args\":{\"date\":{\"node\":\"open\"}},\"fn\":\"data.example.org/daily\",\"node\":\"read\"}],\"fn\":\"max\",\"named\":{},\"node\":\"call\"}",
  "ast_sha256": "196fb098430de01d6c020f52dbceee9c6a7b07964ab0ce2d59c887c497dd0208",
  "body": "max(data.example.org/daily(date: *))\n",
  "inputs": [
    "data.example.org/daily"
  ],
  "returns": {
    "type": "number",
    "unit": "EUR"
  },
  "asof_dependent": false
}
